{
  "$schema": "https://json-schema.org/draft/2020-12/schema",
  "$id": "https://sustainablecatalyst.com/schemas/narrative-risk/handoff/knowledge-library-source/1.5.0",
  "title": "Knowledge Library Source Handoff 1.5.0",
  "type": "object",
  "additionalProperties": false,
  "required": [
    "document_id",
    "title"
  ],
  "properties": {
    "document_id": {
      "type": "string",
      "minLength": 1
    },
    "title": {
      "type": "string",
      "minLength": 1
    },
    "authors": {
      "type": "array",
      "items": {
        "type": "string",
        "minLength": 1
      },
      "default": []
    },
    "publisher": {
      "type": "string",
      "default": ""
    },
    "published_year": {
      "type": [
        "integer",
        "null"
      ]
    },
    "canonical_url": {
      "type": [
        "string",
        "null"
      ],
      "format": "uri"
    },
    "accessed_at": {
      "type": [
        "string",
        "null"
      ],
      "format": "date-time"
    },
    "content_sha256": {
      "anyOf": [
        {
          "type": "string",
          "pattern": "^[0-9a-f]{64}$"
        },
        {
          "type": "null"
        }
      ]
    },
    "source_type": {
      "enum": [
        "official_or_primary",
        "peer_reviewed_or_audited",
        "reputable_secondary",
        "internal_unreviewed",
        "single_report_or_media",
        "social_or_anecdotal",
        "unknown"
      ],
      "default": "reputable_secondary"
    },
    "notes": {
      "type": "string",
      "default": ""
    }
  }
}
